{
  "schema_version": "0.1",
  "event_id": "DSE-SYNTHETIC-001",
  "dyadic_session_id": "DYS-SYNTHETIC-001",
  "event_type": "dyadic_delta_recorded",
  "timestamp": "2026-05-09T09:06:00Z",
  "dataset_type": "synthetic",
  "synthetic_status": "synthetic_only",
  "actor_role": "synthetic_generator",
  "participant_scope": "dyad",
  "session_scope_status": "scope_confirmed",
  "consent_status": "consent_confirmed_both",
  "permission_status": "synthetic_public_example_only",
  "packet_status": "packet_A_present",
  "sharing_scope": "synthetic_public_example_only",
  "private_cue_status": "private_cue_not_used",
  "shared_output_status": "shared_output_recorded",
  "baseline_dyadic_summary_ref": "REF-BASELINE-SYNTHETIC-001",
  "post_output_summary_A_ref": "REF-POST-A-SYNTHETIC-001",
  "post_output_summary_B_ref": "REF-POST-B-SYNTHETIC-001",
  "human_state_delta_A": "toward_recovery",
  "human_state_delta_B": "mixed",
  "dyadic_delta": "dyad_mixed",
  "recovery_gate_decision": "recovery_uncertain",
  "termination_gate_decision": "pause_required",
  "closure_reason": "high_uncertainty",
  "data_quality_status": "sufficient",
  "confidence_status": "medium",
  "boundary_flags": {
    "raw_human_data_present": false,
    "identifiable_data_present": false,
    "clinical_data_present": false,
    "private_state_exposure_risk": false,
    "relationship_verdict_present": false,
    "human_score_present": false,
    "diagnostic_claim_present": false,
    "therapeutic_claim_present": false,
    "counseling_claim_present": false,
    "legal_mediation_claim_present": false,
    "surveillance_claim_present": false,
    "sal_meter_validation_claim_present": false,
    "cais_compliance_claim_present": false,
    "production_intervention_claim_present": false,
    "synthetic_public_data_confirmed": true,
    "audit_log_required": true
  },
  "audit_reference": "AUD-SYNTHETIC-001",
  "final_boundary_status": "boundary_valid",
  "notes": "Synthetic dyadic session event only. No raw human data, no identifiable data, no clinical data, no Sal-Meter validation, no CAIS compliance, no relationship verdict, and no benchmark validation."
}
